{
  "schema_name": "edit_review_decisions",
  "schema_version": "1.0.0",
  "artifact_id": "art_review_decisions",
  "project_id": "prj_demo",
  "revision_id": "rev_001",
  "created_at": "2026-07-22T10:03:00Z",
  "reviewer": {
    "actor": "operator@example.com",
    "role": "editor"
  },
  "proposal_set_artifact_id": "art_proposals",
  "proposal_set_sha256": "eeeeeeeeeeeeeeeeeeeeeeeeeeeeeeeeeeeeeeeeeeeeeeeeeeeeeeeeeeeeeeee",
  "decisions": [
    {
      "proposal_id": "prp_pause_001",
      "proposal_sha256": "aaaaaaaaaaaaaaaaaaaaaaaaaaaaaaaaaaaaaaaaaaaaaaaaaaaaaaaaaaaaaaaa",
      "decision": "approve",
      "modified_cut_range": null,
      "reason": "The pause is mechanical and the handles sound natural"
    },
    {
      "proposal_id": "prp_tail_001",
      "proposal_sha256": "bbbbbbbbbbbbbbbbbbbbbbbbbbbbbbbbbbbbbbbbbbbbbbbbbbbbbbbbbbbbbbbb",
      "decision": "modify",
      "modified_cut_range": {
        "start_us": 7500000,
        "end_us": 12000000
      },
      "reason": "Keep a longer tail after the final word"
    }
  ]
}
